{
  "api_version": "kdebug.v1",
  "action": "power.resolve",
  "target": {
    "filelist": "/data/project/power/run.f",
    "upf": "/data/project/power/design.upf",
    "workdir": "/data/project/power",
    "defines": [
      "NOVAS_UPF_PKG"
    ],
    "top": "system",
    "upf_version": "2.0"
  },
  "args": {
    "name": "system/PD_TOP",
    "object_type": "npiPwPowerDomain"
  }
}
